{"base_manifest":{"path":"/home/node/constellation_2_runtime/constellation_2/runtime/truth/execution_evidence_v1/manifests/2026-02-15/29cbb31928560ed3c5a1441ad124d7b67a2239938285fc6335098b525ff7f8e4.manifest.json","sha256":"fdeb6e1c449082dd1ee4a6ab0dcb8fcc01d2b3238e0e4e3447e1bced2db756c5"},"day_utc":"2026-02-15","identity_inputs":{"binding_record":{"path":"/home/node/constellation_2_runtime/constellation_2/runtime/truth/execution_evidence_v1/submissions/2026-02-15/29cbb31928560ed3c5a1441ad124d7b67a2239938285fc6335098b525ff7f8e4/binding_record.v1.json","sha256":"3530eae3e0b482637d40b6111896a4e90e278ba8068f4d3c7417d6b00b24df7e"},"mapping_ledger_record":{"path":"/home/node/constellation_2_runtime/constellation_2/runtime/truth/execution_evidence_v1/submissions/2026-02-15/29cbb31928560ed3c5a1441ad124d7b67a2239938285fc6335098b525ff7f8e4/mapping_ledger_record.v1.json","sha256":"e7335dd4506c45ff88ffaa888fbb231bd3b93541f12358faaacf1911c553a270"},"order_plan":{"path":"/home/node/constellation_2_runtime/constellation_2/runtime/truth/execution_evidence_v1/submissions/2026-02-15/29cbb31928560ed3c5a1441ad124d7b67a2239938285fc6335098b525ff7f8e4/order_plan.v1.json","sha256":"40eb67e2c50ec50362ed155b23bfe133927bfb7d250472c5a9fd22e0b20f744a"}},"produced_utc":"2026-02-15T00:00:00Z","producer":{"git_sha":"df9695bf1d7cfc99188f87744a400d50f8b242ee","module":"constellation_2/phaseF/execution_evidence/run/run_execution_evidence_truth_day_v1.py","repo":"constellation_2_runtime"},"reason_codes":["IDENTITY_INPUTS_PRESENT_PATCH_V1"],"schema_id":"C2_EXECUTION_EVIDENCE_SUBMISSION_MANIFEST_IDENTITY_PATCH_V1","schema_version":1,"status":"OK","submission_id":"29cbb31928560ed3c5a1441ad124d7b67a2239938285fc6335098b525ff7f8e4"}
